{
  "record_id": "rec_bc_003",
  "schema": "braincase/state-record@1",
  "memory_domain": "coding",
  "tier": "artifact_memory",
  "record_type": "artifact_reference",
  "claim": "docs/braincase-memory-tool-api.md documents the BrainCase memory tool plane architecture as of 2026-05-15.",
  "summary": "Architecture doc covering: core doctrine (LLM is memory operator, BrainCaseDB is storage case), high-level interaction loop, six memory tools (recall/search/inspect/write/update/render), harness policy, deterministic helper layer, BrainCaseDB storage role, memory domains vs tiers, and implementation slices A-F.",
  "status": "active",
  "visibility": "internal",
  "confidence": 1.0,
  "importance": 0.9,
  "retention": "durable",
  "created_at_ms": 1778803200000,
  "updated_at_ms": 1778803200000,
  "source_refs": ["sref_doc_braincase_api", "sref_github_commit_cf31592"],
  "tags": ["braincase", "doc", "architecture", "artifact", "memory-tool-api"],
  "supersedes": null,
  "superseded_by": null,
  "metadata": {
    "file_path": "docs/braincase-memory-tool-api.md",
    "commit": "cf31592"
  }
}
