{
  "record_id": "rec_bc_004",
  "schema": "braincase/state-record@1",
  "memory_domain": "coding",
  "tier": "preference_constraint_memory",
  "record_type": "constraint",
  "claim": "Memory implementation must start from tool semantics, harness policy, memory tiers, and render boundaries — not from SQL tables. SQL is an implementation accelerator behind helpers, not the architecture.",
  "summary": "Do not start memory work from database schema design. Start from: what tools does the LLM need? What does each tool do? What are the memory tiers? What becomes model-visible and how? Design tools first; let BrainCaseDB schema follow from Slice A fixtures.",
  "status": "active",
  "visibility": "internal",
  "confidence": 1.0,
  "importance": 0.9,
  "retention": "durable",
  "created_at_ms": 1778803200000,
  "updated_at_ms": 1778803200000,
  "source_refs": ["sref_doc_braincase_api", "sref_github_issue_53"],
  "tags": ["braincase", "sql", "constraint", "architecture", "doctrine", "tool-semantics-first"],
  "supersedes": null,
  "superseded_by": null,
  "metadata": null
}
